{
  "manifestVersion": 1,
  "profileKey": "arcturus_morningstar_default_swf_pack",
  "sourceKind": "local",
  "clientFamily": "flash_swf_reference",
  "eraKey": "modern_flash_pack_reference",
  "domain": "git.krews.org/morningstar/arcturus-morningstar-default-swf-pack",
  "revisionKey": "a7cea19c8877fb31fa53108655e96d94e4ce7e8e",
  "roots": [
    {
      "rootKey": "arcturus_morningstar_default_swf_pack",
      "path": "/Users/yasminluengo/Documents/Playground/reference-sources/arcturus-morningstar-default-swf-pack"
    }
  ]
}
